filename,shape,sampling_rate,duration_sec,split,speaker_id,chapter_id,id,text
./data\raw_recordings\librispeech_8296_266250_0020.wav,"(222480,)",16000,13.905,train.other.500,8296,266250,8296_266250_0020,THEN BEGGED THEIR MOTHER TO TELL THEM AGAIN ABOUT DEAR GRANDMA THEY HAD HEARD THE STORY ALL THAT MAMMA AND MAMMY COULD TELL MANY TIMES BUT IT NEVER LOST ITS CHARM YES DEARS I WILL I LOVE TO THINK AND SPEAK OF HER ELSIE SAID
./data\raw_recordings\librispeech_2063_148526_0025.wav,"(220080,)",16000,13.755,train.other.500,2063,148526,2063_148526_0025,CAUSES OF FANATICAL ENTHUSIASM IN SOME AMERICANS ALTHOUGH THE DESIRE OF ACQUIRING THE GOOD THINGS OF THIS WORLD IS THE PREVAILING PASSION OF THE AMERICAN PEOPLE CERTAIN
./data\raw_recordings\librispeech_8296_266250_0030.wav,"(59360,)",16000,3.71,train.other.500,8296,266250,8296_266250_0030,BUT SHE POOR THING HAD NONE TO LOVE OR CHERISH HER BUT HER MAMMY
./data\raw_recordings\librispeech_8296_279865_0033.wav,"(164560,)",16000,10.285,train.other.500,8296,279865,8296_279865_0033,OF THE WASBASHA OR OSAGES WHO KEPT A REVERENCE FOR THEIR ANCESTORS NEVER HUNTING THE BEAVER BECAUSE IN KILLING THAT ANIMAL THEY WOULD KILL A BROTHER OF THE OSAGE
./data\raw_recordings\librispeech_8296_279865_0032.wav,"(59840,)",16000,3.74,train.other.500,8296,279865,8296_279865_0032,THE OSAGE READILY CONSENTED AND FROM THIS HAPPY MARRIAGE
./data\raw_recordings\librispeech_8296_279865_0050.wav,"(204880,)",16000,12.805,train.other.500,8296,279865,8296_279865_0050,THEY WERE NOW VERY FAR NORTH NEAR THE NORTHWEST CORNER OF WHAT IS THE STATE OF NORTH DAKOTA GAME WAS STILL PLENTIFUL BUT THE BANKS OF THE RIVER WERE COVERED WITH A COATING OF ALKALI SALTS
./data\raw_recordings\librispeech_8296_279865_0061.wav,"(251680,)",16000,15.73,train.other.500,8296,279865,8296_279865_0061,UPSET THE CANOE THE BOAT WOULD HAVE TURNED UPSIDE DOWN BUT FOR THE RESISTANCE OF THE CANVAS AWNING THE OTHER BOATS HASTENED TO THE RESCUE RIGHTED THE CANOE AND BY BALING HER OUT KEPT HER FROM SINKING THEY ROWED THE CANOE TO SHORE AND THE CARGO WAS SAVED
./data\raw_recordings\librispeech_8296_279865_0017.wav,"(167520,)",16000,10.47,train.other.500,8296,279865,8296_279865_0017,IN TIME THIS PURCHASE OF LOUISIANA OR THE TERRITORY STRETCHING TO THE ROCKY MOUNTAINS FORMING THE LARGER PART OF WHAT ARE NOW THIRTEEN OF THE STATES OF THE UNION
./data\raw_recordings\librispeech_8296_279865_0093.wav,"(138880,)",16000,8.68,train.other.500,8296,279865,8296_279865_0093,THEY HAD TO STOP AND SEARCH FOR A SUBSTITUTE AND FINALLY FOUND WILLOW TREES WHICH PROVIDED THEM WITH ENOUGH WOOD TO PATCH UP THE BOAT CARRIAGE
